{
  "$schema": "https://json-schema.org/draft/2020-12/schema",
  "title": "SV-Bench Run Manifest",
  "type": "object",
  "additionalProperties": true,
  "required": [
    "run_id",
    "git_sha",
    "timestamp_utc",
    "environment_id",
    "environment_version",
    "dataset_id",
    "dataset_revision",
    "split",
    "model_id",
    "model_revision_or_digest",
    "sampling_params",
    "reward_config_id",
    "reward_config_hash",
    "seed",
    "platform_mode",
    "trainer",
    "max_steps",
    "rollouts_per_example",
    "max_tokens",
    "max_turns",
    "tool_budget",
    "input_artifacts",
    "output_artifacts",
    "metrics_summary_path",
    "results_jsonl_path",
    "metadata_json_path",
    "notes"
  ],
  "properties": {
    "run_id": {"type": "string", "minLength": 1},
    "git_sha": {"type": "string", "minLength": 1},
    "timestamp_utc": {"type": "string", "pattern": "^\\d{4}-\\d{2}-\\d{2}T\\d{2}:\\d{2}:\\d{2}Z$"},
    "environment_id": {"type": "string", "minLength": 1},
    "environment_version": {"type": "string", "minLength": 1},
    "dataset_id": {"type": "string", "minLength": 1},
    "dataset_revision": {"type": "string", "minLength": 1},
    "split": {"type": "string", "minLength": 1},
    "model_id": {"type": "string", "minLength": 1},
    "model_revision_or_digest": {"type": "string", "minLength": 1},
    "sampling_params": {"type": "object"},
    "reward_config_id": {"type": "string", "minLength": 1},
    "reward_config_hash": {"type": "string", "minLength": 1},
    "seed": {"type": "integer"},
    "platform_mode": {"enum": ["local", "hosted", "fallback-hosted"]},
    "trainer": {"enum": ["none", "grpo", "gdpo", "distillation", "other"]},
    "max_steps": {"type": "integer", "minimum": 0},
    "rollouts_per_example": {"type": "integer", "minimum": 1},
    "max_tokens": {"type": "integer", "minimum": 1},
    "max_turns": {"type": "integer", "minimum": 1},
    "tool_budget": {"type": "integer", "minimum": 0},
    "input_artifacts": {"type": "array", "items": {"type": "string"}},
    "output_artifacts": {"type": "array", "items": {"type": "string"}},
    "metrics_summary_path": {"type": "string", "minLength": 1},
    "results_jsonl_path": {"type": "string", "minLength": 1},
    "metadata_json_path": {"type": "string", "minLength": 1},
    "notes": {"type": "string"},
    "prime_run_id": {"type": "string"},
    "team": {"type": "string"},
    "compute_profile": {"type": "string"},
    "platform_image": {"type": "string"},
    "adapter_id": {"type": "string"},
    "reward_source": {"enum": ["executable", "llm_judge", "hybrid", "other"]},
    "budget_group": {"type": "string"}
  }
}
