{
  "budget_group": "fixture-e2-public-mini",
  "dataset_id": "datasets/public_mini/e2.jsonl",
  "dataset_revision": "public-mini-v1",
  "environment_id": "sv-env-config-verification",
  "environment_version": "0.2.13",
  "git_sha": "fixture",
  "input_artifacts": ["datasets/public_mini/e2.jsonl", "configs/eval/e2_tool_only.toml"],
  "max_steps": 0,
  "max_tokens": 4096,
  "max_turns": 5,
  "metadata_json_path": "bench/fixtures/e2_metadata.json",
  "metrics_summary_path": "bench/fixtures/e2_summary.json",
  "model_id": "tool-only",
  "model_revision_or_digest": "fixture",
  "notes": "Checked-in local fixture manifest for validator tests.",
  "output_artifacts": ["bench/fixtures/e2_results.jsonl"],
  "platform_mode": "local",
  "results_jsonl_path": "bench/fixtures/e2_results.jsonl",
  "reward_config_hash": "fixture",
  "reward_config_id": "e2_executable_reward",
  "reward_source": "executable",
  "rollouts_per_example": 1,
  "run_id": "fixture-e2-local",
  "sampling_params": {"temperature": 0.0},
  "seed": 42,
  "split": "public_mini",
  "timestamp_utc": "2026-05-15T00:00:00Z",
  "tool_budget": 3,
  "trainer": "none"
}
